{
  "feature": "upload-document",
  "version": "v1",
  "command": "pnpm --filter server test --verbose && pnpm --filter client test --verbose --runInBand",
  "source": "--cmd",
  "exitCode": 0,
  "timedOut": false,
  "signal": null,
  "commit": "86f0cb71fd7af0a22b2fc8d7942072503cd38728",
  "branch": "feature/upload-document",
  "startedAt": "2026-10-25T23:12:13.855Z",
  "finishedAt": "2026-10-25T23:20:42.135Z",
  "durationMs": 508272,
  "outputHash": "sha256:82231634aa8e9a55859ef4cb89ffe66493213f016c0b4c2063fc77b263d5dc28",
  "summary": {
    "passed": 694,
    "failed": 0,
    "skipped": 0,
    "total": 694
  },
  "testIds": [],
  "acIds": [],
  "outputTail": "\u001b[39m (\u001b[33m!\u001b[39mcancelled) setProviders(list)\u001b[33m;\u001b[39m })\n     \u001b[90m    |\u001b[39m                                         \u001b[31m\u001b[1m^\u001b[22m\u001b[39m\n     \u001b[90m 13 |\u001b[39m       \u001b[33m.\u001b[39m\u001b[36mcatch\u001b[39m(() \u001b[33m=>\u001b[39m undefined)\u001b[33m;\u001b[39m\n     \u001b[90m 14 |\u001b[39m     \u001b[36mreturn\u001b[39m () \u001b[33m=>\u001b[39m { cancelled \u001b[33m=\u001b[39m \u001b[36mtrue\u001b[39m\u001b[33m;\u001b[39m }\u001b[33m;\u001b[39m\n     \u001b[90m 15 |\u001b[39m   }\u001b[33m,\u001b[39m [])\u001b[33m;\u001b[39m\u001b[0m\n\n      at ../node_modules/.pnpm/react-dom@19.3.0_react@19.3.0/node_modules/react-dom/cjs/react-dom-client.development.js:20466:19\n      at runWithFiberInDEV (../node_modules/.pnpm/react-dom@19.3.0_react@19.3.0/node_modules/react-dom/cjs/react-dom-client.development.js:1048:13)\n      at warnIfUpdatesNotWrappedWithActDEV (../node_modules/.pnpm/react-dom@19.3.0_react@19.3.0/node_modules/react-dom/cjs/react-dom-client.development.js:20465:9)\n      at scheduleUpdateOnFiber (../node_modules/.pnpm/react-dom@19.3.0_react@19.3.0/node_modules/react-dom/cjs/react-dom-client.development.js:17920:11)\n      at dispatchSetStateInternal (../node_modules/.pnpm/react-dom@19.3.0_react@19.3.0/node_modules/react-dom/cjs/react-dom-client.development.js:9556:13)\n      at dispatchSetState (../node_modules/.pnpm/react-dom@19.3.0_react@19.3.0/node_modules/react-dom/cjs/react-dom-client.development.js:9513:7)\n      at setProviders (src/features/sso/hooks/useSsoProviders.ts:12:41)\n\n  console.error\n    An update to SsoButtons inside a test was not wrapped in act(...).\n    \n    When testing, code that causes React state updates should be wrapped into act(...):\n    \n    act(() => {\n      /* fire events that update state */\n    });\n    /* assert on the output */\n    \n    This ensures that you're testing the behavior the user would see in the browser. Learn more at https://react.dev/link/wrap-tests-with-act\n\n    \u001b[0m \u001b[90m 10 |\u001b[39m     \u001b[36mlet\u001b[39m cancelled \u001b[33m=\u001b[39m \u001b[36mfalse\u001b[39m\u001b[33m;\u001b[39m\n     \u001b[90m 11 |\u001b[39m     ssoApi\u001b[33m.\u001b[39mproviders()\n    \u001b[31m\u001b[1m>\u001b[22m\u001b[39m\u001b[90m 12 |\u001b[39m       \u001b[33m.\u001b[39mthen((list) \u001b[33m=>\u001b[39m { \u001b[36mif\u001b[39m (\u001b[33m!\u001b[39mcancelled) setProviders(list)\u001b[33m;\u001b[39m })\n     \u001b[90m    |\u001b[39m                                         \u001b[31m\u001b[1m^\u001b[22m\u001b[39m\n     \u001b[90m 13 |\u001b[39m       \u001b[33m.\u001b[39m\u001b[36mcatch\u001b[39m(() \u001b[33m=>\u001b[39m undefined)\u001b[33m;\u001b[39m\n     \u001b[90m 14 |\u001b[39m     \u001b[36mreturn\u001b[39m () \u001b[33m=>\u001b[39m { cancelled \u001b[33m=\u001b[39m \u001b[36mtrue\u001b[39m\u001b[33m;\u001b[39m }\u001b[33m;\u001b[39m\n     \u001b[90m 15 |\u001b[39m   }\u001b[33m,\u001b[39m [])\u001b[33m;\u001b[39m\u001b[0m\n\n      at ../node_modules/.pnpm/react-dom@19.3.0_react@19.3.0/node_modules/react-dom/cjs/react-dom-client.development.js:20466:19\n      at runWithFiberInDEV (../node_modules/.pnpm/react-dom@19.3.0_react@19.3.0/node_modules/react-dom/cjs/react-dom-client.development.js:1048:13)\n      at warnIfUpdatesNotWrappedWithActDEV (../node_modules/.pnpm/react-dom@19.3.0_react@19.3.0/node_modules/react-dom/cjs/react-dom-client.development.js:20465:9)\n      at scheduleUpdateOnFiber (../node_modules/.pnpm/react-dom@19.3.0_react@19.3.0/node_modules/react-dom/cjs/react-dom-client.development.js:17920:11)\n      at dispatchSetStateInternal (../node_modules/.pnpm/react-dom@19.3.0_react@19.3.0/node_modules/react-dom/cjs/react-dom-client.development.js:9556:13)\n      at dispatchSetState (../node_modules/.pnpm/react-dom@19.3.0_react@19.3.0/node_modules/react-dom/cjs/react-dom-client.development.js:9513:7)\n      at setProviders (src/features/sso/hooks/useSsoProviders.ts:12:41)\n\n\n$ node --experimental-vm-modules ./node_modules/jest/bin/jest.js \"--verbose\"\n(node:34008) ExperimentalWarning: VM Modules is an experimental feature and might change at any time\n(Use `node --trace-warnings ...` to show where the warning was created)\nTest Suites: 48 passed, 48 total\nTests:       694 passed, 694 total\nSnapshots:   0 total\nTime:        16.058 s\nRan all test suites.\n$ jest \"--verbose\" \"--runInBand\"\nTest Suites: 193 passed, 193 total\nTests:       1925 passed, 1925 total\nSnapshots:   0 total\nTime:        486.835 s, estimated 1379 s\nRan all test suites.\n",
  "recordedAt": "2026-10-25T23:20:42.249Z"
}
